Food Code,Food Name,Description,Group,Tsp,Table spn,Cup,Serving,One,
18-493,"Kidney, lamb, fried in corn oil","10 samples, skin and core removed",MG,,,,,,
18-402,"Kidney, lamb, raw",10 samples,MG,,,,,,
18-404,"Kidney, ox, raw",12 samples,MG,,,,,,
18-405,"Kidney, ox, stewed","10 samples, skin and core removed",MG,,,,,,
18-407,"Kidney, pig, fried","10 samples, skin and core removed",MG,,,,,,
18-406,"Kidney, pig, raw",12 samples,MG,,,,,,
18-408,"Kidney, pig, stewed","20 samples, core removed. Salt added",MG,,,,,,
16-398,"Kippers, flesh only, boil in the bag, with butter, cooked","9 samples, 7 products, frozen and chilled",JC,,,,,,
16-397,"Kippers, flesh only, grilled","7 samples, 7 products, frozen and chilled",JC,,,,,,
16-476,"Kippers, flesh only, grilled, fillets weighed with bones and skin",Calculated from 16-397 using edible conversion factor of 0.89,JC,,,,,,
14-371,"Kiwi fruit, flesh only, raw","11 samples, imported. Including flesh and seeds",FA,,,,,,
14-373,"Kiwi fruit, flesh only, raw, weighed with skin",Calculated from 14-371,FA,,,,,,
12-605,"Knickerbocker glory, homemade","Recipe, containing raspberry sauce, peaches, ice cream, UHT canned spray cream and flaked almonds",BP,,,,,,
19-642,"Kofta, beef, homemade",Recipe,MR,,,,,,
19-594,"Kofta, lamb, coated with breadcrumbs, homemade",Recipe,MR,,,,,,
13-576,"Kohl rabi, boiled in unsalted water","Peeled thickly, diced and boiled 22 minutes, based on boiled in salted water",DG,,,,,,
13-261,"Kohl rabi, raw",Peeled thickly,DG,,,,,,
12-606,"Kulfi, homemade",Indian ice cream. Recipe,BP,,,,,,
14-125,"Kumquats, whole fruit, raw",Analysis and literature sources; whole fruit,FA,,,,,,
17-212,"Lager, alcohol-free","10 samples, including Kaliber, Beck's Blue, Equator, Bitburger Drive, Cobra Zero and Holsten Pils Alcohol Free",QA,,,,,,
17-676,"Lager, extra strong","Approx. 9% ABV, including Carlsberg Special Brew, Skol Super, Tennent's Super and Kestrel Super",QA,,,,,,
17-750,"Lager, low alcohol","2-3% ABV. 10 samples, including  Bavaria Permium, Carling Zest, Carling C2, Beck's Premier Light and own brand",QA,,,,,,
17-751,"Lager, premium","Approx. 5% ABV, 10 samples including Bitburger Pils, San Miguel, Stella Artois, Bud, Kronenbourg, Grolsch, Beck's and Carlsberg Export",QA,,,,,,
17-749,"Lager, standard","<4.5% ABV, canned and draught, including Skol, Hofmeister, Tennents, Carling Black Label, Stella Artois and Foster's",QA,,,,,,
19-598,"Lamb stir-fried with vegetables, homemade",Recipe,MR,,,,,,
18-478,"Lamb, average, raw, lean and fat",Calculated from 83% lean and 17% fat,MAE,,,,,,
18-103,"Lamb, best end neck cutlets, barbecued, lean",10 samples,MAE,,,,,,
18-105,"Lamb, best end neck cutlets, barbecued, lean and fat",Calculated from 73% lean and 27% fat,MAE,,,,,,
18-106,"Lamb, best end neck cutlets, barbecued, lean and fat, weighed with bone",Calculated from 18-105,MAE,,,,,,
18-104,"Lamb, best end neck cutlets, barbecued, lean, weighed with fat and bone",Calculated from 18-103,MAE,,,,,,
18-107,"Lamb, best end neck cutlets, grilled, lean",33 samples,MAE,,,,,,
18-109,"Lamb, best end neck cutlets, grilled, lean and fat",Calculated from 68% lean and 32% fat,MAE,,,,,,
18-110,"Lamb, best end neck cutlets, grilled, lean and fat, weighed with bone",Calculated from 18-109,MAE,,,,,,
18-108,"Lamb, best end neck cutlets, grilled, lean, weighed with fat and bone",Calculated from 18-107,MAE,,,,,,
18-101,"Lamb, best end neck cutlets, raw, lean and fat",Calculated from 66% lean and 34% fat,MAE,,,,,,
18-102,"Lamb, best end neck cutlets, raw, lean and fat, weighed with bone",Calculated from 18-101,MAE,,,,,,
18-111,"Lamb, breast, raw, lean",10 samples,MAE,,,,,,
18-112,"Lamb, breast, raw, lean and fat",Calculated from 66% lean and 33% fat,MAE,,,,,,
18-113,"Lamb, breast, roasted, lean",10 samples,MAE,,,,,,
18-114,"Lamb, breast, roasted, lean and fat",Calculated from 62% lean and 36% fat,MAE,,,,,,
18-117,"Lamb, chump chops, fried, lean",35 samples of a mixture of chops and steaks,MAE,,,,,,
18-119,"Lamb, chump chops, fried, lean and fat",Calculated from 76% lean and 24% fat,MAE,,,,,,
18-120,"Lamb, chump chops, fried, lean and fat, weighed with bone",Calculated from 18-119,MAE,,,,,,
18-118,"Lamb, chump chops, fried, lean, weighed with fat and bone",Calculated from 18-117,MAE,,,,,,
18-115,"Lamb, chump chops, raw, lean and fat",Calculated from 77% lean and 23% fat,MAE,,,,,,
18-116,"Lamb, chump chops, raw, lean and fat, weighed with bone",Calculated from 18-115,MAE,,,,,,
18-122,"Lamb, chump steaks, fried, lean and fat",Calculated from 80% lean and 19% fat,MAE,,,,,,
18-121,"Lamb, chump steaks, raw, lean and fat",Calculated from 79% lean and 19% fat,MAE,,,,,,
18-100,"Lamb, fat, average, cooked","Average of 8 different cuts, trimmed of lean",MAE,,,,,,
18-098,"Lamb, fat, average, raw","Average of 8 different cuts, trimmed of lean",MAE,,,,,,
18-099,"Lamb, fat, raw, average, extra trimmed",Weighted average of 7 different cuts,MAE,,,,,,
18-475,"Lamb, lean only, raw, average",Average of 8 different cuts,MAE,,,,,,
18-097,"Lamb, lean only, raw, average, extra trimmed",Weighted average of 7 different cuts,MAE,,,,,,
18-124,"Lamb, leg chops, grilled, lean and fat",Calculated from 91% lean and 9% fat,MAE,,,,,,
18-125,"Lamb, leg chops, grilled, lean and fat, weighed with bone",Calculated from 18-124,MAE,,,,,,
18-131,"Lamb, leg joint, roasted, lean",10 samples; boneless,MAE,,,,,,
18-132,"Lamb, leg joint, roasted, lean and fat",Calculated from 90% lean and 8% fat,MAE,,,,,,
18-133,"Lamb, leg steaks, grilled, lean",29 samples,MAE,,,,,,
18-134,"Lamb, leg steaks, grilled, lean and fat",Calculated from 94% lean and 6% fat,MAE,,,,,,
18-126,"Lamb, leg, half fillet, braised, lean",10 samples,MAE,,,,,,
18-127,"Lamb, leg, half fillet, braised, lean and fat",Calculated from 84% lean and 16% fat,MAE,,,,,,
18-128,"Lamb, leg, half knuckle, pot-roasted, lean",10 samples,MAE,,,,,,
18-129,"Lamb, leg, half knuckle, pot-roasted, lean and fat",Calculated from 89% lean and 11% fat,MAE,,,,,,
18-130,"Lamb, leg, half knuckle, pot-roasted, lean and fat, weighed with bone",Calculated from 18-129,MAE,,,,,,
18-137,"Lamb, leg, whole, roasted well done, lean",10 samples,MAE,,,,,,
18-138,"Lamb, leg, whole, roasted well done, lean and fat",Calculated from 89% lean and 11% fat,MAE,,,,,,
18-480,"Lamb, leg, whole, roasted, lean and fat",Calculated from 89% lean and 11% fat,MAE,,,,,,
18-479,"Lamb, leg, whole, roasted, lean only",10 samples,MAE,,,,,,
18-141,"Lamb, loin chops, grilled, lean",33 samples,MAE,,,,,,
18-477,"Lamb, loin chops, grilled, lean and fat",Calculated from 76% lean and 24% fat,MAE,,,,,,
18-496,"Lamb, loin chops, grilled, lean and fat, weighed with bone",Calculated from 18-477,MAE,,,,,,
18-142,"Lamb, loin chops, grilled, lean, weighed with fat and bone",Calculated from 18-141,MAE,,,,,,
18-145,"Lamb, loin chops, microwaved, lean",10 samples,MAE,,,,,,
18-147,"Lamb, loin chops, microwaved, lean and fat",Calculated from 72% lean and 28% fat,MAE,,,,,,
18-148,"Lamb, loin chops, microwaved, lean and fat, weighed with bone",Calculated from 18-147,MAE,,,,,,
18-146,"Lamb, loin chops, microwaved, lean, weighed with fat and bone",Calculated from 18-145,MAE,,,,,,
18-476,"Lamb, loin chops, raw, lean and fat",Calculated from 72% lean and 28% fat,MAE,,,,,,
18-497,"Lamb, loin chops, raw, lean and fat, weighed with bone",Calculated from 18-476,MAE,,,,,,
18-149,"Lamb, loin chops, roasted, lean",35 samples,MAE,,,,,,
18-151,"Lamb, loin chops, roasted, lean and fat",Calculated from 73% lean and 27% fat,MAE,,,,,,
18-152,"Lamb, loin chops, roasted, lean and fat, weighed with bone",Calculated from 18-151,MAE,,,,,,
18-150,"Lamb, loin chops, roasted, lean, weighed with fat and bone",Calculated from 18-149,MAE,,,,,,
18-153,"Lamb, loin joint, raw, lean and fat",Calculated from 66% lean and 34% fat,MAE,,,,,,
18-154,"Lamb, loin joint, raw, lean and fat, weighed with bone",Calculated from 18-153,MAE,,,,,,
18-155,"Lamb, loin joint, roasted, lean",10 samples,MAE,,,,,,
18-156,"Lamb, loin joint, roasted, lean and fat",Calculated from 78% lean and 22% fat,MAE,,,,,,
18-157,"Lamb, loin joint, roasted, lean and fat, weighed with bone",Calculated from 18-156,MAE,,,,,,
18-481,"Lamb, mince, raw",10 samples,MAE,,,,,,
18-159,"Lamb, mince, stewed",10 samples,MAE,,,,,,
19-608,"Lamb, mince, stewed with onions","Recipe, containing onion, stock, flour and seasoning",MR,,,,,,
18-160,"Lamb, neck fillet, raw, lean",10 samples,MAE,,,,,,
18-161,"Lamb, neck fillet, raw, lean and fat",Calculated from 87% lean and 12% fat,MAE,,,,,,
18-162,"Lamb, neck fillet, slices, grilled, lean",10 samples,MAE,,,,,,
18-163,"Lamb, neck fillet, slices, grilled, lean and fat",Calculated from 89% lean and 9% fat,MAE,,,,,,
18-164,"Lamb, neck fillet, strips, stir-fried  in corn oil, lean",10 samples,MAE,,,,,,
18-165,"Lamb, neck fillet, strips, stir-fried in corn oil, lean and fat",Calculated from 84% lean and 14% fat,MAE,,,,,,
18-188,"Lamb, New Zealand, leg, whole, chilled, roasted, lean",7 samples,MAE,,,,,,
18-189,"Lamb, New Zealand, leg, whole, chilled, roasted, lean and fat",Calculated from 92% lean and 8% fat,MAE,,,,,,
18-190,"Lamb, New Zealand, leg, whole, frozen, raw, lean and fat, weighed with bone",Calculated from 64% lean and 12% fat,MAE,,,,,,
18-191,"Lamb, New Zealand, leg, whole, frozen, roasted, lean",10 samples,MAE,,,,,,
18-192,"Lamb, New Zealand, leg, whole, frozen, roasted, lean and fat",Calculated from 89% lean and 11% fat,MAE,,,,,,
18-193,"Lamb, New Zealand, leg, whole, frozen, roasted, lean and fat, weighed with bone",Calculated from 18-192,MAE,,,,,,
18-194,"Lamb, New Zealand, loin chops, frozen, grilled, lean",44 samples,MAE,,,,,,
18-196,"Lamb, New Zealand, loin chops, frozen, grilled, lean and fat",Calculated from 75% lean and 25% fat,MAE,,,,,,
18-197,"Lamb, New Zealand, loin chops, frozen, grilled, lean and fat, weighed with bone",Calculated from 18-196,MAE,,,,,,
18-195,"Lamb, New Zealand, loin chops, frozen, grilled, lean, weighed with fat and bone",Calculated from 18-194,MAE,,,,,,
18-198,"Lamb, New Zealand, mince, frozen, stewed",8 samples,MAE,,,,,,
18-199,"Lamb, New Zealand, shoulder, whole, frozen, roasted, lean",9 samples,MAE,,,,,,
18-200,"Lamb, New Zealand, shoulder, whole, frozen, roasted, lean and fat",Calculated from 75% lean and 25% fat,MAE,,,,,,
18-168,"Lamb, rack of, lean, roasted",10 samples,MAE,,,,,,
18-166,"Lamb, rack of, raw, lean and fat",Calculated from 69% lean and 31% fat,MAE,,,,,,
18-167,"Lamb, rack of, raw, lean and fat, weighed with bone",Calculated from 18-166,MAE,,,,,,
18-169,"Lamb, rack of, roasted, lean and fat",Calculated from 66% lean and 34% fat,MAE,,,,,,
18-177,"Lamb, shoulder joint, roasted, lean",10 samples,MAE,,,,,,
18-178,"Lamb, shoulder joint, roasted, lean and fat",Calculated from 82% lean and 16% fat,MAE,,,,,,
18-172,"Lamb, shoulder, diced, kebabs, grilled, lean and fat",Calculated from 85% lean and 15% fat,MAE,,,,,,
18-173,"Lamb, shoulder, half bladeside, pot-roasted, lean",10 samples,MAE,,,,,,
18-174,"Lamb, shoulder, half bladeside, pot-roasted, lean and fat",Calculated from 72% lean and 28% fat,MAE,,,,,,
18-175,"Lamb, shoulder, half knuckle, braised, lean",10 samples,MAE,,,,,,
18-176,"Lamb, shoulder, half knuckle, braised, lean and fat",Calculated from 74% lean and 26% fat,MAE,,,,,,
18-170,"Lamb, shoulder, raw, lean and fat",Calculated from 76% lean and 24% fat,MAE,,,,,,
18-171,"Lamb, shoulder, raw, lean and fat, weighed with bone",Calculated from 18-170,MAE,,,,,,
18-179,"Lamb, shoulder, whole, roasted, lean",10 samples,MAE,,,,,,
18-180,"Lamb, shoulder, whole, roasted, lean and fat",Calculated from 78% lean and 22% fat,MAE,,,,,,
18-181,"Lamb, shoulder, whole, roasted, lean and fat, weighed with bone",Calculated from 18-180,MAE,,,,,,
18-184,"Lamb, stewing, pressure cooked, lean",10 samples,MAE,,,,,,
18-185,"Lamb, stewing, pressure cooked, lean and fat",Calculated from 82% lean and 18% fat,MAE,,,,,,
18-182,"Lamb, stewing, raw, lean and fat",Calculated from 80% lean and 20% fat,MAE,,,,,,
18-183,"Lamb, stewing, raw, lean and fat, weighed with bone",Calculated from 18-182,MAE,,,,,,
18-186,"Lamb, stewing, stewed, lean",10 samples,MAE,,,,,,
18-187,"Lamb, stewing, stewed, lean and fat",Calculated from 85% lean and 15% fat,MAE,,,,,,
19-600,"Lamb's heart casserole, homemade",Recipe,MR,,,,,,
19-601,"Lancashire hotpot, homemade",Recipe,MR,,,,,,
16-425,"Langoustine, boiled","Small, medium and large from 3 fishing areas",JK,,,,,,
17-010,Lard,"6 samples, 3 brands",OF,,,,,,
19-481,"Lasagne, homemade","Beef, Recipe",MR,,,,,,
19-482,"Lasagne, homemade, with extra lean minced beef",Recipe,MR,,,,,,
19-523,"Lasagne, retail, reheated","12 samples, 11 brands. 10-20% meat, chilled and frozen",MR,,,,,,
15-186,"Lasagne, spinach, wholemeal, homemade",Recipe from dietary survey records,DR,,,,,,
15-651,"Lasagne, vegetable, retail",8 assorted samples; cooked in conventional and microwave ovens according to packet directions,DR,,,,,,
15-188,"Lasagne, vegetable, wholemeal, homemade",Recipe from dietary survey records,DR,,,,,,
12-373,"Lassi, sweetened","5 samples, takeaway and retail",BN,,,,,,
15-190,Laverbread,6 samples; cooked pureed seaweed coated in oatmeal,DR,,,,,,
15-813,"Leeks in cheese sauce, made with semi-skimmed milk, homemade","Recipe, proportions derived from recipe review",DR,,,,,,
15-814,"Leeks in cheese sauce, made with skimmed milk, homemade","Recipe, proportions derived from recipe review",DR,,,,,,
15-815,"Leeks in cheese sauce, made with whole milk, homemade","Recipe, proportions derived from recipe review",DR,,,,,,
13-625,"Leeks, boiled in unsalted water","11 samples, UK, trimmed and damaged outer leaves removed. Sliced and boiled for 5-8 minutes",DG,,,,,,
13-624,"Leeks, raw","11 samples, UK, trimmed and damaged outer leaves removed",DG,,,,,,
13-626,"Leeks, roasted in rapeseed oil","Calculated from raw. Water and fat analysed, 2017. 11 samples, mainly UK, trimmed and damaged outer leaves removed. Whole, sliced, halved and roasted for 25-40 minutes",DG,,,,,,
19-602,"Lemon chicken, homemade",Recipe,MR,,,,,,
17-762,Lemon curd,"10 jars, 4 brands",SC,,,,,,
17-806,"Lemon curd, homemade",Recipe,S,,,,,,
14-277,"Lemon juice, fresh",Analysis and literature sources,PE,,,,,,
14-278,"Lemon juice, fresh, weighed as whole fruit",Calculated from 14-277,FC,,,,,,
14-337,Lemon peel,Literature sources,FA,,,,,,
16-380,"Lemon sole, flesh only, grilled","7 samples, 6 products, frozen and chilled",JA,,,,,,
16-379,"Lemon sole, flesh only, raw","7 samples, 6 products, frozen and chilled",JA,,,,,,
16-478,"Lemon sole, flesh only, steamed","Calculated based on 23.2% weight loss (as haddock, steamed in 2013 fish survey)",JA,,,,,,
16-496,"Lemon sole, flesh only, steamed, weighed with bones and skin",Calculated from steamed 16-478,JA,,,,,,
16-087,"Lemon sole, goujons, baked",Calculated from manufacturers' proportions,JA,,,,,,
17-179,Lemonade,"10 samples, 8 brands",PCA,,,,,,
17-807,"Lemonade, homemade",Recipe,PCC,,,,,,
14-130,"Lemons, flesh only, raw, weighed with peel and pips",Calculated from 14-129,FA,,,,,,
14-129,"Lemons, peeled, flesh only",Literature sources;,FA,,,,,,
14-128,"Lemons, whole, without pips",Includes peel but no pips. Analysis and literature sources,FA,,,,,,
15-200,"Lentil and nut roast, homemade",Recipe from review of recipe collection,DR,,,,,,
15-201,"Lentil and nut roast, with egg, homemade",Recipe from review of recipe collection,DR,,,,,,
15-817,"Lentil and potato pie, homemade",Recipe from dietary survey records,DR,,,,,,
15-818,"Lentil and rice roast, homemade",Recipe from dietary survey records,DR,,,,,,
15-819,"Lentil and rice roast, with egg, homemade",Recipe from dietary survey records,DR,,,,,,
15-820,"Lentil cutlets, fried in vegetable oil, homemade",Recipe. Gujerati dish.  Red lentil and potato cutlets.,DR,,,,,,
15-821,"Lentil pie, homemade",Recipe from review of recipe collection,DR,,,,,,
15-198,"Lentil roast, homemade",Recipe from review of recipe collection,DR,,,,,,
15-199,"Lentil roast, with egg, homemade",Recipe from review of recipe collection,DR,,,,,,
13-661,"Lentils, green and brown, whole, dried, boiled in unsalted water","11 samples, 10 products, soaked and boiled for 15-50 minutes",DB,,,,,,
13-089,"Lentils, green and brown, whole, dried, raw","10 samples, 6 brands. Continental type",DB,,,,,,
13-658,"Lentils, red, split, dried, boiled in unsalted water","10 samples, 10 products, boiled for 15-40 minutes",DB,,,,,,
13-657,"Lentils, red, split, dried, raw","10 samples, 10 products, as purchased",DB,,,,,,
13-520,"Lettuce, average, raw","22 samples, autumn and winter, UK grown and imported, including shredded, Iceberg, Romaine and Little Gem",DG,,,,,,
17-201,"Lime juice cordial, diluted",Calculated from 50g concentrate to 200ml water,PCC,,,,,,
17-200,"Lime juice cordial, undiluted",6 bottles of the same brand (Roses),PCC,,,,,,
14-279,"Lime juice, fresh",Literature sources,FC,,,,,,
14-131,"Limes, flesh only",Literature sources;,FA,,,,,,
14-132,"Limes, flesh only, weighed with peel and pips",Calculated from 14-131,FA,,,,,,
16-091,"Ling, raw",Literature sources,JA,,,,,,
17-768,"Liqueurs, cream","17% ABV, 2 samples of Baileys Original Irish Cream",QI,,,,,,
17-244,"Liqueurs, high strength","30-40% ABV. 5 samples including Pernod, Drambuie, Cointreau, Grand Marnier and Southern Comfort",QI,,,,,,
17-245,"Liqueurs, low-medium strength","20-28% ABV. 10 samples including cherry brandy, Tia Maria and Creme de Menthe",QI,,,,,,
17-777,Liquorice allsorts,"7 samples, 4 brands",SEC,,,,,,
13-833,Liquorice powder,Literature sources,H,,,,,,
19-603,"Liver and bacon, fried, homemade",Recipe,MR,,,,,,
19-604,"Liver and onions, stewed, homemade",Recipe,MR,,,,,,
19-106,Liver sausage,"10 samples, 4 brands",MI,,,,,,
18-410,"Liver, calf, fried in corn oil",10 samples,MG,,,,,,
18-409,"Liver, calf, raw",10 samples,MG,,,,,,
18-412,"Liver, chicken, fried in corn oil",10 samples,MG,,,,,,
18-411,"Liver, chicken, raw",10 samples,MG,,,,,,
18-494,"Liver, lamb, fried in corn oil",10 samples,MG,,,,,,
18-413,"Liver, lamb, raw",10 samples,MG,,,,,,
18-415,"Liver, ox, raw",33 samples,MG,,,,,,
18-416,"Liver, ox, stewed","18 samples, coated in seasoned flour",MG,,,,,,
18-417,"Liver, pig, raw",10 samples,MG,,,,,,
18-418,"Liver, pig, stewed","18 samples, coated in seasoned flour",MG,,,,,,
16-332,"Lobster, boiled",Boiled in fresh water,JK,,,,,,
16-343,"Lobster, boiled, weighed with shell",Calculated from boiled 16-332,JK,,,,,,
14-133,"Loganberries, raw",Whole fruit,FA,,,,,,
14-134,"Loganberries, stewed with sugar","Calculated from 700g fruit, 210g water, 84g sugar",FA,,,,,,
14-135,"Loganberries, stewed without sugar","Calculated from 700g fruit, 210g water",FA,,,,,,
12-390,"Lollies, containing ice-cream",3 samples,BP,,,,,,
12-389,"Lollies, with real fruit juice","10 samples, 6 brands, assorted flavours",BP,,,,,,
14-138,"Longans, canned in syrup, drained",Literature sources; fruit only,FA,,,,,,
14-139,"Longans, canned in syrup, whole contents",Literature sources; fruit and syrup,FA,,,,,,
14-137,"Longans, flesh only, dried",Literature sources,FA,,,,,,
14-140,"Loquats, flesh only, raw",Literature sources;,FA,,,,,,
13-271,"Lotus tubers, raw",Literature sources,DG,,,,,,
17-761,Lucozade,"Including lemon, orange and tropical flavours",PCA,,,,,,
19-136,"Luncheon meat, Chinese, steamed","10 samples from different shops, steamed for 15 minutes",MI,,,,,,
14-143,"Lychees, flesh only, raw, weighed with skin and stone",Calculated from 14-143,FA,,,,,,
14-142,"Lychees, raw, flesh only",Analysis and literature sources;,FA,,,,,,
14-891,"Macadamia nuts, salted",8 samples,G,,,,,,
11-954,"Macaroni cheese, homemade",Recipe,AD,,,,305,,
12-951,"Macaroon, homemade",Recipe,CDH,,,,,,
13-834,"Mace, ground",Literature sources,H,,,,,,
16-394,"Mackerel, flesh only, grilled","7 samples, 7 products, frozen and chilled",JC,,,,,,
16-479,"Mackerel, flesh only, grilled, fillets weighed with bones and skin",Calculated from 16-394 using 0.98 edible conversion factor,JC,,,,,,
16-393,"Mackerel, flesh only, raw","7 samples, 7 products, frozen and chilled",JC,,,,,,
16-414,"Mackerel, flesh only, smoked","11 samples, 11 products, flesh only",JC,,,,,,
17-651,Maltesers and similar products,"9 samples, 3 products",SEA,,,,,,
14-145,"Mammie apple, flesh only",Literature sources;,FA,,,,,,
14-146,"Mandarin oranges, canned in juice, whole contents","10 samples, 4 brands. Drained proportion = 0.56",FA,,,,,,
13-273,"Mango, unripe, green flesh, raw",Literature sources.,DG,,,,,,
14-378,"Mangoes, ripe, flesh only, raw","11 samples, imported, whole and prepacked chunks",FA,,,,,,
14-379,"Mangoes, ripe, flesh only, raw, weighed with skin and stone",Calculated from 14-378,FA,,,,,,
14-151,"Mangosteen, flesh only",Literature sources;,FA,,,,,,
13-835,"Marjoram, dried",Literature sources,H,,,,,,
17-078,Marmalade,4 brands,SC,,,,,,
13-276,"Marrow, boiled in unsalted water",Based on boiled in salted water,DG,,,,,,
13-277,"Marrow, parwal, raw",5 samples. Ends trimmed,DG,,,,,,
13-274,"Marrow, raw","Flesh only, seeds removed",DG,,,,,,
17-668,Mars bar and own brand equivalents,"16 samples, 3 brands, including standard, snack and fun size",SEA,,,,,,
17-114,Marshmallows,7 samples of different brands,SEC,,,,,,
14-893,"Marzipan, homemade",Recipe,GA,,,,,,
14-875,"Marzipan, white and yellow, retail",10 samples,GA,,,,,,
13-588,"Matoki, boiled in unsalted water","Green banana from East Africa. LGC. As raw; chopped and boiled 12 minutes, based on boiled in salted water",DG,,,,,,
13-279,"Matoki, raw",5 samples. Flesh only,DG,,,,,,
17-809,"Mayonnaise, homemade",Recipe,WC,,,,,,
17-679,"Mayonnaise, reduced fat","12 samples, 8 brands",WCG,,,,,,
17-654,"Mayonnaise, standard, retail","11 samples,7 products",WCG,,,,,,
15-822,"Mchicha, homemade",Recipe. West Indian dish. Steamed spinach with onion and tomato.,DR,,,,,,
19-605,"Meat loaf, homemade",Recipe,MR,,,,,,
19-326,"Meat samosas, takeaway",10 samples from Indian restaurants,MR,,,,,,
19-506,Meat spread,10 samples of a mixture of beef and ham based spreads. 70-90% meat,MI,,,,,,
19-613,"Meatballs, pork and beef, in tomato sauce, homemade",Recipe,MR,,,,,,
14-152,"Medlars, flesh only",Flesh only,FA,,,,,,
14-826,Melon seeds,Literature sources,GA,,,,,,
14-339,"Melon, Canteloupe-type, flesh only","10 samples, Canteloupe, Charantais and Rock;",FA,,,,,,
14-352,"Melon, Canteloupe-type, flesh only, weighed whole",Calculated from 14-339 using edible portion of 0.59,FA,,,,,,
14-353,"Melon, Canteloupe-type, flesh only, weighed with skin",Calculated from 14-339 using edible portion of 0.66; no pips,FA,,,,,,
14-354,"Melon, flesh only, average","Average of Canteloupe-type, Galia and Honeydew varieties",FA,,,,,,
14-355,"Melon, flesh only, average, weighed whole",Calculated from 14-354 using edible conversion factor of 0.62,FA,,,,,,
14-356,"Melon, flesh only, average, weighed with skin",Calculated from 14-354 using edible conversion factor of 0.66; no pips,FA,,,,,,
14-159,"Melon, Galia, flesh only",11 samples;,FA,,,,,,
14-160,"Melon, Galia, flesh only, weighed whole",Calculated from 14-159,FA,,,,,,
14-161,"Melon, Galia, flesh only, weighed with skin",Calculated from 14-159; no pips,FA,,,,,,
14-357,"Melon, Honeydew, flesh only, weighed whole",Calculated from 14-328 using edible conversion factor of 0.58,FA,,,,,,
14-358,"Melon, Honeydew, flesh only, weighed with skin",Calculated from 14-328 using edible conversion factor of 0.62;  no pips,FA,,,,,,
14-296,"Melon, watermelon, flesh only",Literature sources;,FA,,,,,,
14-309,"Melon, watermelon, flesh only, weighed whole",Calculated from 14-296,FA,,,,,,
14-328,"Melon, yellow flesh, flesh only","22 samples, Honeydew, autumn and winter, whole and pre-prepared slices",FA,,,,,,
12-517,"Meringue, homemade",Without cream. Recipe,BR,,,,,,
12-585,"Meringue, with cream, homemade",Recipe. Ref. Wiles et al. (1980),BR,,,,,,
15-628,"Methi aloo, homemade","6 samples, fenugreek and potatoes",DR,,,,,,
11-1091,"Milk bread, homemade",Recipe,AF,,,,,,
12-513,"Milk drink, fermented, with probiotics","Including Yakult, Danone, Muller and own brand yogurt drinks",BH,,,,,,
17-733,"Milk shake, powder","6 samples (Nesquik), 3 flavours",PAA,,,,,,
12-589,"Milk shake, powder, made up with semi-skimmed milk",Recipe. Calculated from 15g powder to 200ml milk,BH,,,,,,
12-590,"Milk shake, powder, made up with skimmed milk",Recipe. Calculated from 15g powder to 200ml milk,BH,,,,,,
12-591,"Milk shake, powder, made up with whole milk",Recipe. Calculated from 15g powder to 200ml milk,BH,,,,,,
12-512,"Milk, 1% fat, pasteurised",Average of skimmed (12-307) and semi-skimmed (12-313) milk,BA,,,,,,
12-321,"Milk, Channel Islands, whole, pasteurised","Breakfast milk, average of 6 samples of summer and winter milk",BAB,,,,,,
12-322,"Milk, Channel islands, whole, summer",3 samples,BAB,,,,,,
12-323,"Milk, Channel islands, whole, winter",3 samples,BAB,,,,,,
12-520,"Milk, condensed, whole, sweetened","10 cans, 2 brands",BAR,,,,,,
12-324,"Milk, evaporated, light","7 samples, 4 brands",BAR,,,,,,
12-522,"Milk, evaporated, whole","12 samples, Ideal, Carnation and own brands",BAR,,,,,,
12-535,"Milk, flavoured, pasteurised, chocolate","9 samples, 6 brands, including low fat, semi-skimmed",BAR,,,,,,
12-326,"Milk, flavoured, pasteurised, strawberry, banana","10 samples, 6 brands, including low fat and semi-skimmed",BAR,,,,,,
12-328,"Milk, goats, pasteurised",20 samples from one herd and literature sources,BC,,,,,,
12-038,"Milk, human, colostrum",Literature sources,BC,,,,,,
12-536,"Milk, human, mature",Literature sources,BC,,,,,,
12-039,"Milk, human, transitional","Mixed sample, 15 mothers at 10th day post partum and literature sources",BC,,,,,,
12-313,"Milk, semi-skimmed, pasteurised, average","Average of summer/autumn and winter/spring milk. Samples from 11 areas, in glass bottles (50%), plastic containers (30%) and cartons (20%)",BAH,,,,,,
12-418,"Milk, semi-skimmed, pasteurised, summer and autumn",Samples taken in June and September,BAH,,,,,,
12-419,"Milk, semi-skimmed, pasteurised, winter and spring",Samples taken in January and March,BAH,,,,,,
